{
  "$schema": "http://json-schema.org/draft-04/schema#",
  "type": "object",
  "properties": {
    "name": {
      "type": "string"
    },
    "author": {
      "type": "string"
    },
    "date": {
      "type": "string"
    },
    "tracks": {
      "type": "array",
      "items": [
        {
          "type": "object",
          "properties": {
            "id": {
              "type": "string"
            },
            "name": {
              "type": "string"
            },
            "events": {
              "type": "array",
              "items": [
                {
                  "type": "object",
                  "properties": {
                    "id": {
                      "type": "string"
                    },
                    "name": {
                      "type": "string"
                    },
                    "type": {
                      "type": "string"
                    }
                  },
                  "required": [
                    "id",
                    "name",
                    "type"
                  ]
                }
              ]
            },
            "actions": {
              "type": "array",
              "items": [
                {
                  "type": "object",
                  "properties": {
                    "id": {
                      "type": "string"
                    },
                    "operation": {
                      "type": "string"
                    },
                    "time": {
                      "type": "integer"
                    }
                  },
                  "required": [
                    "id",
                    "operation",
                    "time"
                  ]
                }
              ]
            },
            "forks": {
              "type": "array",
              "items": {}
            }
          },
          "required": [
            "id",
            "name",
            "events",
            "actions",
            "forks"
          ]
        },
        {
          "type": "object",
          "properties": {
            "id": {
              "type": "string"
            },
            "name": {
              "type": "string"
            },
            "events": {
              "type": "array",
              "items": [
                {
                  "type": "object",
                  "properties": {
                    "id": {
                      "type": "string"
                    },
                    "name": {
                      "type": "string"
                    },
                    "type": {
                      "type": "string"
                    }
                  },
                  "required": [
                    "id",
                    "name",
                    "type"
                  ]
                }
              ]
            },
            "actions": {
              "type": "array",
              "items": [
                {
                  "type": "object",
                  "properties": {
                    "id": {
                      "type": "string"
                    },
                    "operation": {
                      "type": "string"
                    },
                    "time": {
                      "type": "integer"
                    }
                  },
                  "required": [
                    "id",
                    "operation",
                    "time"
                  ]
                },
                {
                  "type": "object",
                  "properties": {
                    "id": {
                      "type": "string"
                    },
                    "operation": {
                      "type": "string"
                    },
                    "time": {
                      "type": "integer"
                    }
                  },
                  "required": [
                    "id",
                    "operation",
                    "time"
                  ]
                },
                {
                  "type": "object",
                  "properties": {
                    "id": {
                      "type": "string"
                    },
                    "operation": {
                      "type": "string"
                    },
                    "time": {
                      "type": "integer"
                    }
                  },
                  "required": [
                    "id",
                    "operation",
                    "time"
                  ]
                }
              ]
            },
            "forks": {
              "type": "array",
              "items": [
                {
                  "type": "object",
                  "properties": {
                    "id": {
                      "type": "string"
                    },
                    "condition": {
                      "type": "string"
                    }
                  },
                  "required": [
                    "id",
                    "condition"
                  ]
                }
              ]
            }
          },
          "required": [
            "id",
            "name",
            "events",
            "actions",
            "forks"
          ]
        }
      ]
    },
    "streams": {
      "type": "array",
      "items": [
        {
          "type": "object",
          "properties": {
            "id": {
              "type": "string"
            },
            "from": {
              "type": "object",
              "properties": {
                "id": {
                  "type": "string"
                },
                "type": {
                  "type": "string"
                },
                "itemId": {
                  "type": "string"
                }
              },
              "required": [
                "id",
                "type",
                "itemId"
              ]
            },
            "to": {
              "type": "object",
              "properties": {
                "id": {
                  "type": "string"
                },
                "type": {
                  "type": "string"
                },
                "itemId": {
                  "type": "string"
                }
              },
              "required": [
                "id",
                "type",
                "itemId"
              ]
            },
            "name": {
              "type": "null"
            }
          },
          "required": [
            "id",
            "from",
            "to",
            "name"
          ]
        },
        {
          "type": "object",
          "properties": {
            "id": {
              "type": "string"
            },
            "from": {
              "type": "object",
              "properties": {
                "id": {
                  "type": "string"
                },
                "type": {
                  "type": "string"
                },
                "itemId": {
                  "type": "string"
                }
              },
              "required": [
                "id",
                "type",
                "itemId"
              ]
            },
            "to": {
              "type": "object",
              "properties": {
                "id": {
                  "type": "string"
                },
                "type": {
                  "type": "string"
                },
                "itemId": {
                  "type": "string"
                }
              },
              "required": [
                "id",
                "type",
                "itemId"
              ]
            },
            "name": {
              "type": "null"
            }
          },
          "required": [
            "id",
            "from",
            "to",
            "name"
          ]
        },
        {
          "type": "object",
          "properties": {
            "id": {
              "type": "string"
            },
            "from": {
              "type": "object",
              "properties": {
                "id": {
                  "type": "string"
                },
                "type": {
                  "type": "string"
                },
                "itemId": {
                  "type": "string"
                }
              },
              "required": [
                "id",
                "type",
                "itemId"
              ]
            },
            "to": {
              "type": "object",
              "properties": {
                "id": {
                  "type": "string"
                },
                "type": {
                  "type": "string"
                },
                "itemId": {
                  "type": "string"
                }
              },
              "required": [
                "id",
                "type",
                "itemId"
              ]
            },
            "name": {
              "type": "null"
            }
          },
          "required": [
            "id",
            "from",
            "to",
            "name"
          ]
        },
        {
          "type": "object",
          "properties": {
            "id": {
              "type": "string"
            },
            "from": {
              "type": "object",
              "properties": {
                "id": {
                  "type": "string"
                },
                "type": {
                  "type": "string"
                },
                "itemId": {
                  "type": "string"
                }
              },
              "required": [
                "id",
                "type",
                "itemId"
              ]
            },
            "to": {
              "type": "object",
              "properties": {
                "id": {
                  "type": "string"
                },
                "type": {
                  "type": "string"
                },
                "itemId": {
                  "type": "string"
                }
              },
              "required": [
                "id",
                "type",
                "itemId"
              ]
            },
            "name": {
              "type": "string"
            }
          },
          "required": [
            "id",
            "from",
            "to",
            "name"
          ]
        },
        {
          "type": "object",
          "properties": {
            "id": {
              "type": "string"
            },
            "from": {
              "type": "object",
              "properties": {
                "id": {
                  "type": "string"
                },
                "type": {
                  "type": "string"
                },
                "itemId": {
                  "type": "string"
                }
              },
              "required": [
                "id",
                "type",
                "itemId"
              ]
            },
            "to": {
              "type": "object",
              "properties": {
                "id": {
                  "type": "string"
                },
                "type": {
                  "type": "string"
                },
                "itemId": {
                  "type": "string"
                }
              },
              "required": [
                "id",
                "type",
                "itemId"
              ]
            },
            "name": {
              "type": "string"
            }
          },
          "required": [
            "id",
            "from",
            "to",
            "name"
          ]
        },
        {
          "type": "object",
          "properties": {
            "id": {
              "type": "string"
            },
            "from": {
              "type": "object",
              "properties": {
                "id": {
                  "type": "string"
                },
                "type": {
                  "type": "string"
                },
                "itemId": {
                  "type": "string"
                }
              },
              "required": [
                "id",
                "type",
                "itemId"
              ]
            },
            "to": {
              "type": "object",
              "properties": {
                "id": {
                  "type": "string"
                },
                "type": {
                  "type": "string"
                },
                "itemId": {
                  "type": "string"
                }
              },
              "required": [
                "id",
                "type",
                "itemId"
              ]
            },
            "name": {
              "type": "null"
            }
          },
          "required": [
            "id",
            "from",
            "to",
            "name"
          ]
        },
        {
          "type": "object",
          "properties": {
            "id": {
              "type": "string"
            },
            "from": {
              "type": "object",
              "properties": {
                "id": {
                  "type": "string"
                },
                "type": {
                  "type": "string"
                },
                "itemId": {
                  "type": "string"
                }
              },
              "required": [
                "id",
                "type",
                "itemId"
              ]
            },
            "to": {
              "type": "object",
              "properties": {
                "id": {
                  "type": "string"
                },
                "type": {
                  "type": "string"
                },
                "itemId": {
                  "type": "string"
                }
              },
              "required": [
                "id",
                "type",
                "itemId"
              ]
            },
            "name": {
              "type": "null"
            }
          },
          "required": [
            "id",
            "from",
            "to",
            "name"
          ]
        }
      ]
    }
  },
  "required": [
    "name",
    "author",
    "date",
    "tracks",
    "streams"
  ]
}